[
  {
    "vilkaar" : "ART12_1_FORUTGAAENDE_MEDLEMSKAP",
    "oppfylt" : true,
    "begrunnelseKoder" : [

    ],
    "begrunnelseFritekst" : null
  },
  {
    "vilkaar" : "ART12_1_VESENTLIG_VIRKSOMHET",
    "oppfylt" : true,
    "begrunnelseKoder" : [

    ],
    "begrunnelseFritekst" : null
  },
  {
    "vilkaar" : "FO_883_2004_ART12_1",
    "oppfylt" : false,
    "begrunnelseKoder" : [

    ],
    "begrunnelseFritekst" : null
  },
  {
    "vilkaar" : "FO_883_2004_ART16_1",
    "oppfylt" : true,
    "begrunnelseKoder" : [

    ],
    "begrunnelseFritekst" : null
  }
]
